{
  "schema_version": "atlas.mission.v1",
  "repository": "Jktomy/atlas-prime",
  "issue_number": 12,
  "mission_id": "SEQUENCE-FIXTURE-MISSION-12",
  "mission_type": "mission/research",
  "mission_state": "CLOSED",
  "created_at": "2026-07-21T14:00:00Z",
  "updated_at": "2026-07-21T14:01:00Z",
  "objective": "Prove the third ordered Mission completes after a nonblocking resumable stop.",
  "rationale_and_decisions": [],
  "owner": {"project": "Project Codex", "operation": "Operation Source Governance"},
  "relationships": {"quest": null, "campaign": null, "gate": null},
  "assigned_worker": "Codex",
  "execution_identity": {"declared_worker": "Codex", "credential_principal": "fixture", "surface": "unit test", "publisher": "NONE"},
  "dependencies": [],
  "public_clean_boundary": {"classification": "PUBLIC_CLEAN", "sanitized_summary": "Synthetic fixture only.", "protected_pointer": null},
  "acceptance_criteria": ["Completion proof is present."],
  "next_safe_action": "Report the ordered results.",
  "effort_class": "BEU_0",
  "queue_behavior": "TERMINAL_ON_BLOCK",
  "canonical_source_status": "NO_SOURCE_CHANGE_REQUIRED",
  "source_binding": {"base_sha": null, "branch": null, "pull_request": null, "expected_head": null, "changed_paths": [], "changed_paths_digest": null, "merged_commit": null},
  "validation_review": {"validation_status": "PASS", "review_status": "RESOLVED", "strikeforce_status": "GREEN", "receipt_refs": ["fixture://mission-12"]},
  "coppermind": {"status": "NOT_APPLICABLE", "reference": null, "archive_timestamp": null, "archive_package": null},
  "completion_proof": ["fixture://mission-12-complete"],
  "rollback": "No source change exists to roll back.",
  "attempt_id": "SEQUENCE-FIXTURE-MISSION-12-ATTEMPT-01"
}
