{
  "schema_version": "atlas.mission.v1",
  "repository": "Jktomy/atlas-prime",
  "issue_number": 258,
  "mission_id": "MISSION-BOARD-FOUNDATION-R01",
  "mission_type": "mission/repair",
  "mission_state": "CANONICAL",
  "created_at": "2026-07-21T13:15:23Z",
  "updated_at": "2026-07-21T15:00:00Z",
  "objective": "Make the Mission Board contract canonical.",
  "rationale_and_decisions": ["GitHub Issues coordinate work; merged Prime remains source authority."],
  "owner": {"project": "Project Codex", "operation": "Operation Source Governance"},
  "relationships": {"quest": "QUEST-PRIME-ASCENDANT-20260717", "campaign": "PA-C01", "gate": "PA-C01-COVENANT-REFINEMENT"},
  "assigned_worker": "Codex",
  "execution_identity": {"declared_worker": "Codex", "credential_principal": "Jktomy", "surface": "Codex", "publisher": "Aegis Break Git"},
  "dependencies": [],
  "public_clean_boundary": {"classification": "PUBLIC_CLEAN", "sanitized_summary": "Fixture contains synthetic repository identities only.", "protected_pointer": null},
  "acceptance_criteria": ["Canonical main contains the exact Mission Board contract."],
  "next_safe_action": "Prepare the public-clean Coppermind closeout package.",
  "effort_class": "BEU_3",
  "queue_behavior": "TERMINAL_ON_BLOCK",
  "canonical_source_status": "CANONICAL",
  "source_binding": {"base_sha": "1111111111111111111111111111111111111111", "branch": "codex/mission-board-foundation-r01", "pull_request": 260, "expected_head": "2222222222222222222222222222222222222222", "changed_paths": ["governance/mission-board-contract.md"], "changed_paths_digest": "6120ee16bde780482c63f50e7d58805374842380c76c8f76fbc1d99206dd6964", "merged_commit": "3333333333333333333333333333333333333333"},
  "validation_review": {"validation_status": "PASS", "review_status": "RESOLVED", "strikeforce_status": "GREEN", "receipt_refs": ["fixture://exact-head-validation"]},
  "coppermind": {"status": "PENDING", "reference": null, "archive_timestamp": null, "archive_package": null},
  "completion_proof": ["fixture://canonical-main-readback"],
  "rollback": "Use one separately reviewed revert or repair-forward PR.",
  "attempt_id": "MISSION-BOARD-FOUNDATION-ATTEMPT-01"
}
