{
  "schema_version": "atlas.mission.v1",
  "repository": "Jktomy/atlas-prime",
  "issue_number": 7,
  "mission_id": "SEQUENCE-FIXTURE-MISSION-7",
  "mission_type": "mission/research",
  "mission_state": "BLOCKED_RESUMABLE",
  "created_at": "2026-07-21T14:00:00Z",
  "updated_at": "2026-07-21T14:01:00Z",
  "objective": "Prove a declared nonblocking resumable stop preserves queue progress.",
  "rationale_and_decisions": ["The blocker has no dependency edge to Mission 12."],
  "owner": {"project": "Project Codex", "operation": "Operation Source Governance"},
  "relationships": {"quest": null, "campaign": null, "gate": null},
  "assigned_worker": "Codex",
  "execution_identity": {"declared_worker": "Codex", "credential_principal": "fixture", "surface": "unit test", "publisher": "NONE"},
  "dependencies": [{"relation": "NONBLOCKING_RELATED", "repository": "Jktomy/atlas-prime", "mission_ref": "Mission 12"}],
  "public_clean_boundary": {"classification": "PUBLIC_CLEAN", "sanitized_summary": "Synthetic fixture only.", "protected_pointer": null},
  "acceptance_criteria": ["The valid partial state remains restartable."],
  "next_safe_action": "Await the synthetic external prerequisite and preserve this attempt.",
  "effort_class": "BEU_1",
  "queue_behavior": "CONTINUE_IF_BLOCKED_RESUMABLE",
  "canonical_source_status": "PHOENIX_PENDING",
  "source_binding": {"base_sha": null, "branch": null, "pull_request": null, "expected_head": null, "changed_paths": [], "changed_paths_digest": null, "merged_commit": null},
  "validation_review": {"validation_status": "PENDING", "review_status": "NOT_STARTED", "strikeforce_status": "NOT_RUN", "receipt_refs": []},
  "coppermind": {"status": "PENDING", "reference": null, "archive_timestamp": null, "archive_package": null},
  "completion_proof": [],
  "rollback": "Preserve the same synthetic attempt and do not create a duplicate.",
  "attempt_id": "SEQUENCE-FIXTURE-MISSION-7-ATTEMPT-01"
}
