{
  "schema_version": "atlas.mission.v1",
  "repository": "Jktomy/atlas-prime",
  "issue_number": 257,
  "mission_id": "CAMPAIGN-CODEX-OPEN-PATHWAYS-SUNSET-R01",
  "mission_type": "mission/campaign",
  "mission_state": "BLOCKED_RESUMABLE",
  "created_at": "2026-07-21T11:50:05Z",
  "updated_at": "2026-07-21T15:00:00Z",
  "objective": "Preserve prior pathway and Sunset Router work for explicit post-foundation reconciliation.",
  "rationale_and_decisions": ["Issue #257 is related deferred history and is not duplicated into Mission #258."],
  "owner": {"project": "Project Codex", "operation": "Operation Source Governance"},
  "relationships": {"quest": "QUEST-PRIME-ASCENDANT-20260717", "campaign": "PA-C01", "gate": null},
  "assigned_worker": "UNASSIGNED",
  "execution_identity": {"declared_worker": "UNASSIGNED", "credential_principal": "UNASSIGNED", "surface": "GitHub Issues", "publisher": "UNASSIGNED"},
  "dependencies": [{"relation": "BLOCKED_BY", "repository": "Jktomy/atlas-prime", "mission_ref": "Mission #258"}],
  "public_clean_boundary": {"classification": "PUBLIC_CLEAN", "sanitized_summary": "Only public-clean prior campaign context is referenced.", "protected_pointer": null},
  "acceptance_criteria": ["Resume only after Mission #258 canonical readback and a fresh warrant."],
  "next_safe_action": "After Mission #258 is canonical, reread #257 and current main, then prepare a replacement warrant without source mutation.",
  "effort_class": "BEU_8",
  "queue_behavior": "CONTINUE_IF_BLOCKED_RESUMABLE",
  "canonical_source_status": "PHOENIX_PENDING",
  "source_binding": {"base_sha": null, "branch": null, "pull_request": null, "expected_head": null, "changed_paths": [], "changed_paths_digest": null, "merged_commit": null},
  "validation_review": {"validation_status": "NOT_STARTED", "review_status": "NOT_STARTED", "strikeforce_status": "NOT_RUN", "receipt_refs": []},
  "coppermind": {"status": "PENDING", "reference": null, "archive_timestamp": null, "archive_package": null},
  "completion_proof": [],
  "rollback": "Preserve Issue #257 and append explicit reconciliation comments only.",
  "attempt_id": "OPEN-PATHWAYS-SUNSET-ATTEMPT-01"
}
