{
  "schema_version": "atlas.mission.v1",
  "repository": "Jktomy/atlas-prime",
  "issue_number": 259,
  "mission_id": "MISSION-BOARD-SUNSET-PILOT-R01",
  "mission_type": "mission/sunset",
  "mission_state": "CAPTURED",
  "created_at": "2026-07-21T14:00:00Z",
  "updated_at": "2026-07-21T14:00:00Z",
  "objective": "Preserve a public-clean conversation summary for later Phoenix processing.",
  "rationale_and_decisions": ["Capture now without claiming canonical lifecycle completion."],
  "owner": {"project": "Project Codex", "operation": "Operation Source Governance"},
  "relationships": {"quest": "QUEST-PRIME-ASCENDANT-20260717", "campaign": "PA-C01", "gate": null},
  "assigned_worker": "UNASSIGNED",
  "execution_identity": {"declared_worker": "UNASSIGNED", "credential_principal": "UNASSIGNED", "surface": "GitHub Issues", "publisher": "UNASSIGNED"},
  "dependencies": [{"relation": "NONBLOCKING_RELATED", "repository": "Jktomy/atlas-prime", "mission_ref": "Mission #258"}],
  "public_clean_boundary": {"classification": "PUBLIC_CLEAN", "sanitized_summary": "Fixture contains no protected evidence.", "protected_pointer": null},
  "acceptance_criteria": ["The Mission remains searchable and restartable without chat memory."],
  "next_safe_action": "Fresh-read canonical source and decide whether a Phoenix source transaction is required.",
  "effort_class": "BEU_1",
  "queue_behavior": "CONTINUE_IF_BLOCKED_RESUMABLE",
  "canonical_source_status": "PHOENIX_PENDING",
  "source_binding": {"base_sha": null, "branch": null, "pull_request": null, "expected_head": null, "changed_paths": [], "changed_paths_digest": null, "merged_commit": null},
  "validation_review": {"validation_status": "NOT_STARTED", "review_status": "NOT_STARTED", "strikeforce_status": "NOT_RUN", "receipt_refs": []},
  "coppermind": {"status": "PENDING", "reference": null, "archive_timestamp": null, "archive_package": null},
  "completion_proof": [],
  "rollback": "Preserve the Issue and append an explicit correction; do not delete history.",
  "attempt_id": "MISSION-BOARD-SUNSET-PILOT-ATTEMPT-01",
  "sunset": {
    "conversation_summary": "Public-clean context is captured for later bounded processing.",
    "exact_unfinished_work": ["Determine the exact canonical lifecycle record plan."],
    "blockers": [],
    "lesson_harvest_dispositions": ["LOCAL_ONLY: Mission Board captures unfinished context without false completion."],
    "golden_wing_candidate_disposition": "NO_CANDIDATE",
    "record_plan": "Prepare a separately approved lifecycle Preview before any source mutation.",
    "phoenix_processing_pending": true,
    "archival_status": "PENDING",
    "truth_state": "SUNSET_CAPTURED"
  }
}
